DateTime,Currency,EventName,Impact
2025-06-10 06:00,GBP,Employment Change 3M/3M (MoM)  (Apr),Medium
2025-06-10 06:00,GBP,Claimant Count Change  (May),Medium
2025-06-10 07:00,CHF,SECO Consumer Climate  (May),Medium
2025-06-10 14:30,EUR,German Buba Vice President Buch Speaks,Medium
2025-06-10 16:00,USD,EIA Short-Term Energy Outlook,Medium
2025-06-10 17:00,USD,3-Year Note Auction,Medium
2025-06-10 20:00,USD,U.S. President Trump Speaks,High
2025-06-10 20:30,USD,API Weekly Crude Oil Stock,Medium
2025-06-11 03:15,EUR,ECB President Lagarde Speaks,Medium
2025-06-11 09:00,EUR,German Buba Vice President Buch Speaks,Medium
2025-06-11 09:30,EUR,German 10-Year Bund Auction,Medium
2025-06-11 09:30,EUR,ECB's Lane Speaks,Medium
2025-06-11 12:30,USD,CPI (YoY)  (May),High
2025-06-11 12:30,USD,CPI (MoM)  (May),High
2025-06-11 12:30,USD,Core CPI (YoY)  (May),Medium
2025-06-11 12:30,USD,Core CPI (MoM)  (May),High
2025-06-11 12:30,CAD,Building Permits (MoM)  (Apr),Medium
2025-06-11 14:30,USD,Cushing Crude Oil Inventories,Medium
2025-06-11 14:30,USD,Crude Oil Inventories,High
2025-06-11 18:00,USD,Federal Budget Balance  (May),Medium
2025-06-11 18:00,USD,10-Year Note Auction,High
2025-06-11 22:45,NZD,Electronic Card Retail Sales (MoM)  (May),Medium
2025-06-11 23:50,JPY,BSI Large Manufacturing Conditions  (Q2),Medium
2025-06-12 06:00,GBP,Trade Balance  (Apr),Medium
2025-06-12 06:00,GBP,GDP (MoM)  (Apr),High
2025-06-12 06:00,GBP,Industrial Production (MoM)  (Apr),Medium
2025-06-12 06:00,GBP,Trade Balance Non-EU  (Apr),Medium
2025-06-12 06:00,GBP,Monthly GDP 3M/3M Change  (Apr),Medium
2025-06-12 06:00,GBP,Manufacturing Production (MoM)  (Apr),Medium
2025-06-12 09:00,EUR,ECB's Schnabel Speaks,Medium
2025-06-12 10:00,GBP,NIESR Monthly GDP Tracker  (May),Medium
2025-06-12 12:00,EUR,ECB's De Guindos Speaks,Medium
2025-06-12 12:20,EUR,ECB's Schnabel Speaks,Medium
2025-06-12 12:30,USD,Continuing Jobless Claims,Medium
2025-06-12 12:30,USD,Core PPI (MoM)  (May),Medium
2025-06-12 12:30,USD,Initial Jobless Claims,High
2025-06-12 12:30,USD,PPI (MoM)  (May),High
2025-06-12 14:15,EUR,ECB's Elderson Speaks,Medium
2025-06-12 16:00,USD,WASDE Report,Medium
2025-06-12 17:00,USD,30-Year Bond Auction,High
2025-06-12 20:30,USD,Fed's Balance Sheet,Medium
2025-06-12 22:30,NZD,Business NZ PMI  (May),Medium
2025-06-13 04:30,JPY,Industrial Production (MoM)  (Apr),Medium
2025-06-13 06:00,EUR,German CPI (YoY)  (May),Medium
2025-06-13 06:00,EUR,German CPI (MoM)  (May),High
2025-07-07 06:00,GBP,Halifax House Price Index (MoM)  (Jun),Medium
2025-07-07 06:00,GBP,Halifax House Price Index (YoY)  (Jun),Medium
2025-07-07 06:00,EUR,German Industrial Production (MoM)  (May),Medium
2025-07-07 08:00,EUR,German Buba President Nagel Speaks,Medium
2025-07-07 08:30,GBP,Mortgage Rate (GBP)  (Jun),Medium
2025-07-07 10:00,EUR,Eurogroup Meetings,Medium
2025-07-07 19:30,JPY,CFTC JPY speculative net positions,Medium
2025-07-07 19:30,GBP,CFTC GBP speculative net positions,Medium
2025-07-07 19:30,USD,CFTC Crude Oil speculative net positions,Medium
2025-07-07 19:30,USD,CFTC Gold speculative net positions,Medium
2025-07-07 19:30,EUR,CFTC EUR speculative net positions,Medium
2025-07-07 19:30,USD,CFTC S&P 500 speculative net positions,Medium
2025-07-07 19:30,AUD,CFTC AUD speculative net positions,Medium
2025-07-07 19:30,USD,CFTC Nasdaq 100 speculative net positions,Medium
2025-07-07 23:50,JPY,Current Account n.s.a.  (May),Medium
2025-07-07 23:50,JPY,Adjusted Current Account  (May),Medium
2025-07-08 01:30,AUD,NAB Business Confidence  (Jun),Medium
2025-07-08 04:30,AUD,RBA Interest Rate Decision  (Jul),High
2025-07-08 04:30,AUD,RBA Rate Statement,Medium
2025-07-08 06:00,EUR,German Trade Balance  (May),Medium
2025-07-08 14:00,EUR,German Buba President Nagel Speaks,Medium
2025-07-08 14:00,CAD,Ivey PMI  (Jun),Medium
2025-07-08 15:00,USD,NY Fed 1-Year Consumer Inflation Expectations  (Jun),Medium
2025-07-08 16:00,USD,EIA Short-Term Energy Outlook,Medium
2025-07-08 17:00,USD,3-Year Note Auction,Medium
2025-07-08 19:00,USD,Consumer Credit  (May),Medium
2025-07-08 20:30,USD,API Weekly Crude Oil Stock,Medium
2025-07-09 01:30,AUD,Building Approvals (MoM)  (May),Medium
2025-07-09 02:00,NZD,RBNZ Interest Rate Decision,High
2025-07-09 02:00,NZD,RBNZ Rate Statement,Medium
2025-07-09 06:00,GBP,BoE Financial Stability Report,Medium
2025-07-09 09:30,GBP,BoE Financial Stability Report,Medium
2025-07-09 10:45,EUR,ECB's Lane Speaks,Medium
2025-07-09 11:00,EUR,ECB's De Guindos Speaks,Medium
2025-07-09 12:15,EUR,German Buba President Nagel Speaks,Medium
2025-07-09 14:30,USD,Cushing Crude Oil Inventories,Medium
2025-07-09 14:30,USD,Crude Oil Inventories,High
2025-07-09 17:00,USD,Atlanta Fed GDPNow  (Q2),Medium
2025-07-09 17:00,USD,10-Year Note Auction,High
2025-07-09 18:00,USD,FOMC Meeting Minutes,High
2025-07-10 06:00,EUR,German CPI (MoM)  (Jun),High
2025-07-10 06:00,EUR,German CPI (YoY)  (Jun),Medium
2025-07-10 12:30,USD,Initial Jobless Claims,High
2025-07-10 12:30,USD,Continuing Jobless Claims,Medium
2025-07-10 17:00,USD,30-Year Bond Auction,High
2025-07-10 17:15,USD,Fed Waller Speaks,Medium
2025-07-10 18:30,USD,FOMC Member Daly Speaks,Medium
2025-07-10 20:30,USD,Fed's Balance Sheet,Medium
2025-07-10 22:30,NZD,Business NZ PMI  (Jun),Medium
2025-07-11 06:00,GBP,GDP (MoM)  (May),High
2025-07-11 06:00,GBP,Industrial Production (MoM)  (May),Medium
2025-07-11 06:00,GBP,Manufacturing Production (MoM)  (May),Medium
2025-07-11 06:00,GBP,Trade Balance Non-EU  (May),Medium
2025-07-11 06:00,GBP,Monthly GDP 3M/3M Change  (May),Medium
2025-07-11 06:00,GBP,Trade Balance  (May),Medium
2025-07-11 06:45,EUR,French HICP (MoM)  (Jun),Medium
2025-07-11 06:45,EUR,French CPI (MoM)  (Jun),Medium
2025-07-11 07:00,CHF,SECO Consumer Climate  (Jun),Medium
2025-07-11 08:00,USD,IEA Monthly Report,Medium
2025-07-11 12:00,GBP,NIESR Monthly GDP Tracker  (Jun),Medium
2025-07-11 12:30,CAD,Unemployment Rate  (Jun),Medium
2025-07-11 12:30,CAD,Employment Change  (Jun),Medium
2025-07-11 12:30,CAD,Building Permits (MoM)  (May),Medium
2025-07-11 16:00,USD,WASDE Report,Medium
2025-07-11 17:00,USD,U.S. Baker Hughes Total Rig Count,Medium
2025-07-11 17:00,USD,U.S. Baker Hughes Oil Rig Count,Medium
2025-07-11 18:00,USD,Federal Budget Balance  (Jun),Medium
2025-07-11 19:30,EUR,CFTC EUR speculative net positions,Medium
2025-07-11 19:30,JPY,CFTC JPY speculative net positions,Medium
2025-07-11 19:30,AUD,CFTC AUD speculative net positions,Medium
2025-07-11 19:30,USD,CFTC S&P 500 speculative net positions,Medium
2025-07-11 19:30,USD,CFTC Nasdaq 100 speculative net positions,Medium
2025-07-11 19:30,USD,CFTC Gold speculative net positions,Medium
2025-07-11 19:30,USD,CFTC Crude Oil speculative net positions,Medium
2025-07-11 19:30,GBP,CFTC GBP speculative net positions,Medium
2025-07-13 22:45,NZD,Electronic Card Retail Sales (MoM)  (Jun),Medium
2025-07-14 04:30,JPY,Industrial Production (MoM)  (May),Medium
2025-08-06 06:00,EUR,German Factory Orders (MoM)  (Jun),Medium
2025-08-06 14:30,USD,Crude Oil Inventories,High
2025-08-06 14:30,USD,Cushing Crude Oil Inventories,Medium
2025-08-06 17:00,USD,10-Year Note Auction,High
2025-08-06 20:10,USD,FOMC Member Daly Speaks,Medium
2025-08-07 01:30,AUD,Trade Balance  (Jun),Medium
2025-08-07 01:30,AUD,Building Approvals (MoM)  (Jun),Medium
2025-08-07 03:00,NZD,Inflation Expectations (QoQ)  (Q3),Medium
2025-08-07 06:00,EUR,German Trade Balance  (Jun),Medium
2025-08-07 06:00,EUR,German Industrial Production (MoM)  (Jun),Medium
2025-08-07 06:00,GBP,Halifax House Price Index (YoY)  (Jul),Medium
2025-08-07 06:00,GBP,Halifax House Price Index (MoM)  (Jul),Medium
2025-08-07 08:00,EUR,ECB Economic Bulletin,Medium
2025-08-07 08:30,GBP,Mortgage Rate (GBP)  (Jul),Medium
2025-08-07 11:00,GBP,BoE Interest Rate Decision  (Aug),High
2025-08-07 11:00,GBP,BoE MPC vote unchanged  (Aug),Medium
2025-08-07 11:00,GBP,BoE MPC vote hike  (Aug),Medium
2025-08-07 11:00,GBP,BoE MPC vote cut  (Aug),Medium
2025-08-07 11:00,GBP,BoE MPC Meeting Minutes,Medium
2025-08-07 11:30,GBP,BOE Inflation Letter,Medium
2025-08-07 11:30,GBP,BoE Gov Bailey Speaks,Medium
2025-08-07 12:30,USD,Unit Labor Costs (QoQ)  (Q2),Medium
2025-08-07 12:30,USD,Nonfarm Productivity (QoQ)  (Q2),Medium
2025-08-07 12:30,USD,Initial Jobless Claims,High
2025-08-07 12:30,USD,Continuing Jobless Claims,Medium
2025-08-07 14:00,CAD,Ivey PMI  (Jul),Medium
2025-08-07 14:00,USD,FOMC Member Bostic Speaks,Medium
2025-08-07 15:00,USD,NY Fed 1-Year Consumer Inflation Expectations  (Jul),Medium
2025-08-07 16:00,USD,Atlanta Fed GDPNow  (Q3),Medium
2025-08-07 17:00,USD,30-Year Bond Auction,High
2025-08-07 19:00,USD,Consumer Credit  (Jun),Medium
2025-08-07 20:00,USD,U.S. President Trump Speaks,High
2025-08-07 20:30,USD,Fed's Balance Sheet,Medium
2025-08-07 23:30,JPY,Household Spending (MoM)  (Jun),Medium
2025-08-07 23:30,JPY,Household Spending (YoY)  (Jun),Medium
2025-08-07 23:50,JPY,Current Account n.s.a.  (Jun),Medium
2025-08-07 23:50,JPY,Adjusted Current Account  (Jun),Medium
2025-08-08 07:00,CHF,SECO Consumer Climate  (Q3),Medium
2025-08-08 11:15,GBP,BoE MPC Member Pill Speaks,Medium
2025-08-08 12:30,CAD,Unemployment Rate  (Jul),Medium
2025-08-08 12:30,CAD,Employment Change  (Jul),Medium
2025-08-08 17:00,USD,U.S. Baker Hughes Oil Rig Count,Medium
2025-08-08 17:00,USD,U.S. Baker Hughes Total Rig Count,Medium
2025-08-08 19:30,EUR,CFTC EUR speculative net positions,Medium
2025-08-08 19:30,JPY,CFTC JPY speculative net positions,Medium
2025-08-08 19:30,AUD,CFTC AUD speculative net positions,Medium
2025-08-08 19:30,USD,CFTC S&P 500 speculative net positions,Medium
2025-08-08 19:30,USD,CFTC Nasdaq 100 speculative net positions,Medium
2025-08-08 19:30,USD,CFTC Gold speculative net positions,Medium
2025-08-08 19:30,USD,CFTC Crude Oil speculative net positions,Medium
2025-08-08 19:30,GBP,CFTC GBP speculative net positions,Medium
2025-08-09 16:15,USD,FOMC Member Bowman Speaks,Medium
2025-08-11 23:01,GBP,BRC Retail Sales Monitor (YoY)  (Jul),Medium
2025-08-12 01:30,AUD,NAB Business Confidence  (Jul),Medium
2025-08-12 04:30,AUD,RBA Monetary Policy Statement,Medium
2025-08-12 04:30,AUD,RBA Interest Rate Decision  (Aug),High
2025-08-12 04:30,AUD,RBA Rate Statement,Medium
2025-08-12 06:00,GBP,Unemployment Rate  (Jun),Medium
2025-08-12 06:00,GBP,Employment Change 3M/3M (MoM)  (Jun),Medium
2025-08-12 06:00,GBP,Claimant Count Change  (Jul),Medium
2025-08-12 06:00,GBP,Average Earnings Index +Bonus  (Jun),Medium
2025-08-12 09:00,EUR,ZEW Economic Sentiment  (Aug),Medium
2025-08-12 09:00,EUR,German ZEW Economic Sentiment  (Aug),Medium
2025-08-12 09:00,EUR,German ZEW Current Conditions  (Aug),Medium
2025-08-12 11:00,USD,OPEC Monthly Report,Medium
2025-08-12 12:30,USD,Core CPI (MoM)  (Jul),High
2025-08-12 12:30,USD,Core CPI (YoY)  (Jul),Medium
2025-08-12 12:30,USD,CPI (YoY)  (Jul),High
2025-08-12 12:30,CAD,Building Permits (MoM)  (Jun),Medium
2025-08-12 12:30,USD,CPI (MoM)  (Jul),High
2025-08-12 16:00,USD,WASDE Report,Medium
2025-08-12 16:00,USD,EIA Short-Term Energy Outlook,Medium
2025-08-12 18:00,USD,Federal Budget Balance  (Jul),Medium
2025-08-12 20:30,USD,API Weekly Crude Oil Stock,Medium
2025-08-12 22:45,NZD,Electronic Card Retail Sales (MoM)  (Jul),Medium
2025-09-05 06:00,GBP,Core Retail Sales (MoM)  (Jul),Medium
2025-09-05 06:00,GBP,Core Retail Sales (YoY)  (Jul),Medium
2025-09-05 06:00,GBP,Halifax House Price Index (MoM)  (Aug),Medium
2025-09-05 06:00,GBP,Retail Sales (MoM)  (Jul),Medium
2025-09-05 06:00,GBP,Retail Sales (YoY)  (Jul),Medium
2025-09-05 06:00,EUR,German Factory Orders (MoM)  (Jul),Medium
2025-09-05 06:00,GBP,Halifax House Price Index (YoY)  (Aug),Medium
2025-09-05 07:00,CHF,SECO Consumer Climate  (Aug),Medium
2025-09-05 09:00,EUR,GDP (YoY)  (Q2),Medium
2025-09-05 09:00,EUR,GDP (QoQ)  (Q2),Medium
2025-09-05 11:00,GBP,Mortgage Rate (GBP)  (Aug),Medium
2025-09-05 12:30,USD,Average Hourly Earnings (MoM)  (Aug),High
2025-09-05 12:30,USD,Average Hourly Earnings (YoY) (YoY)  (Aug),Medium
2025-09-05 12:30,USD,Nonfarm Payrolls  (Aug),High
2025-09-05 12:30,USD,Private Nonfarm Payrolls  (Aug),Medium
2025-09-05 12:30,USD,U6 Unemployment Rate  (Aug),Medium
2025-09-05 12:30,CAD,Unemployment Rate  (Aug),Medium
2025-09-05 12:30,CAD,Employment Change  (Aug),Medium
2025-09-05 14:00,CAD,Ivey PMI  (Aug),Medium
2025-09-05 17:00,USD,U.S. Baker Hughes Total Rig Count,Medium
2025-09-05 17:00,USD,U.S. Baker Hughes Oil Rig Count,Medium
2025-09-05 19:30,USD,CFTC Crude Oil speculative net positions,Medium
2025-09-05 19:30,USD,CFTC Gold speculative net positions,Medium
2025-09-05 19:30,USD,CFTC Nasdaq 100 speculative net positions,Medium
2025-09-05 19:30,GBP,CFTC GBP speculative net positions,Medium
2025-09-05 19:30,AUD,CFTC AUD speculative net positions,Medium
2025-09-05 19:30,JPY,CFTC JPY speculative net positions,Medium
2025-09-05 19:30,EUR,CFTC EUR speculative net positions,Medium
2025-09-05 19:30,USD,CFTC S&P 500 speculative net positions,Medium
2025-09-07 23:50,JPY,GDP Price Index (YoY)  (Q2),Medium
2025-09-07 23:50,JPY,GDP Annualized (QoQ)  (Q2),Medium
2025-09-07 23:50,JPY,GDP (QoQ)  (Q2),High
2025-09-07 23:50,JPY,Current Account n.s.a.  (Jul),Medium
2025-09-07 23:50,JPY,Adjusted Current Account  (Jul),Medium
2025-09-08 01:30,AUD,Building Approvals (MoM)  (Jul),Medium
2025-09-08 06:00,EUR,German Trade Balance  (Jul),Medium
2025-09-08 06:00,EUR,German Industrial Production (MoM)  (Jul),Medium
2025-09-08 15:00,USD,NY Fed 1-Year Consumer Inflation Expectations  (Aug),Medium
2025-09-08 19:00,USD,Consumer Credit  (Jul),Medium
2025-09-08 23:01,GBP,BRC Retail Sales Monitor (YoY)  (Aug),Medium
2025-09-09 01:30,AUD,NAB Business Confidence  (Aug),Medium
2025-09-09 09:45,EUR,German 10-Year Bund Auction,Medium
2025-09-09 10:00,EUR,Eurogroup Meetings,Medium
2025-09-09 11:30,EUR,German Buba President Nagel Speaks,Medium
2025-09-09 14:00,USD,"Payrolls Benchmark, n.s.a.",Medium
2025-09-09 16:00,USD,EIA Short-Term Energy Outlook,Medium
2025-09-09 17:00,USD,3-Year Note Auction,Medium
2025-09-09 20:30,USD,API Weekly Crude Oil Stock,Medium
2025-09-10 12:00,EUR,German Buba Vice President Buch Speaks,Medium
2025-09-10 12:30,USD,PPI (MoM)  (Aug),High
2025-09-10 12:30,USD,Core PPI (MoM)  (Aug),Medium
2025-09-10 14:30,USD,Crude Oil Inventories,High
2025-09-10 14:30,USD,Cushing Crude Oil Inventories,Medium
2025-09-10 16:30,USD,Atlanta Fed GDPNow  (Q3),Medium
2025-09-10 17:00,USD,10-Year Note Auction,High
2025-09-10 23:50,JPY,BSI Large Manufacturing Conditions  (Q3),Medium
2025-09-11 08:00,USD,IEA Monthly Report,Medium
2025-09-11 11:00,USD,OPEC Monthly Report,Medium
2025-09-11 12:15,EUR,ECB Interest Rate Decision  (Sep),High
2025-09-11 12:15,EUR,ECB Monetary Policy Statement,Medium
2025-09-11 12:15,EUR,ECB Marginal Lending Facility,Medium
2025-09-11 12:15,EUR,Deposit Facility Rate  (Sep),High
2025-09-11 12:30,USD,Core CPI (MoM)  (Aug),High
2025-09-11 12:30,USD,Core CPI (YoY)  (Aug),Medium
2025-09-11 12:30,USD,Continuing Jobless Claims,Medium
2025-09-11 12:30,USD,CPI (YoY)  (Aug),High
2025-09-11 12:30,USD,Initial Jobless Claims,High
2025-09-11 12:30,USD,CPI (MoM)  (Aug),High
2025-09-11 12:45,EUR,ECB Press Conference,High
2025-09-11 14:15,EUR,ECB President Lagarde Speaks,Medium
2025-09-11 17:00,USD,30-Year Bond Auction,High
2025-09-11 18:00,USD,Federal Budget Balance  (Aug),Medium
2025-09-11 20:30,USD,Fed's Balance Sheet,Medium
2025-09-11 22:30,NZD,Business NZ PMI  (Aug),Medium
2025-09-11 22:45,NZD,Electronic Card Retail Sales (MoM)  (Aug),Medium
2025-09-12 04:30,JPY,Industrial Production (MoM)  (Jul),Medium
2025-09-12 06:00,GBP,Manufacturing Production (MoM)  (Jul),Medium
2025-09-12 06:00,GBP,GDP (MoM)  (Jul),High
2025-09-12 06:00,GBP,Industrial Production (MoM)  (Jul),Medium
2025-09-12 06:00,GBP,Trade Balance  (Jul),Medium
2025-09-12 06:00,GBP,Trade Balance Non-EU  (Jul),Medium
2025-09-12 06:00,EUR,German CPI (YoY)  (Aug),Medium
2025-09-12 06:00,EUR,German CPI (MoM)  (Aug),High
2025-09-12 06:00,GBP,Monthly GDP 3M/3M Change  (Jul),Medium
2025-09-12 06:45,EUR,French HICP (MoM)  (Aug),Medium
2025-09-12 06:45,EUR,French CPI (MoM)  (Aug),Medium
2025-10-06 07:15,EUR,ECB's De Guindos Speaks,Medium
2025-10-06 08:00,EUR,ECB's Lane Speaks,Medium
2025-10-06 08:30,GBP,S&P Global Construction PMI  (Sep),Medium
2025-10-06 17:00,EUR,ECB President Lagarde Speaks,Medium
2025-10-06 17:30,GBP,BoE Gov Bailey Speaks,Medium
2025-10-06 21:00,NZD,NZIER Business Confidence  (Q3),Medium
2025-10-06 23:30,JPY,Household Spending (MoM)  (Aug),Medium
2025-10-06 23:30,JPY,Household Spending (YoY)  (Aug),Medium
2025-10-07 06:00,EUR,German Factory Orders (MoM)  (Aug),Medium
2025-10-07 06:00,GBP,Halifax House Price Index (YoY)  (Sep),Medium
2025-10-07 06:00,GBP,Halifax House Price Index (MoM)  (Sep),Medium
2025-10-07 08:30,GBP,Mortgage Rate (GBP)  (Sep),Medium
2025-10-07 12:30,CAD,Trade Balance  (Aug),Medium
2025-10-07 14:00,CAD,Ivey PMI  (Sep),Medium
2025-10-07 14:00,USD,FOMC Member Bostic Speaks,Medium
2025-10-07 14:05,USD,FOMC Member Bowman Speaks,Medium
2025-10-07 15:00,USD,NY Fed 1-Year Consumer Inflation Expectations  (Sep),Medium
2025-10-07 15:30,USD,FOMC Member Kashkari Speaks,Medium
2025-10-07 16:00,USD,EIA Short-Term Energy Outlook,Medium
2025-10-07 16:00,EUR,German Buba President Nagel Speaks,Medium
2025-10-07 16:00,USD,Atlanta Fed GDPNow  (Q3),Medium
2025-10-07 16:10,EUR,ECB President Lagarde Speaks,Medium
2025-10-07 17:00,USD,3-Year Note Auction,Medium
2025-10-07 19:00,USD,Consumer Credit  (Aug),Medium
2025-10-07 20:30,USD,API Weekly Crude Oil Stock,Medium
2025-10-07 23:50,JPY,Current Account n.s.a.  (Aug),Medium
2025-10-07 23:50,JPY,Adjusted Current Account  (Aug),Medium
2025-10-08 00:30,AUD,Building Approvals (MoM)  (Aug),Medium
2025-10-08 01:00,NZD,RBNZ Rate Statement,Medium
2025-10-08 01:00,NZD,RBNZ Interest Rate Decision,High
2025-10-08 06:00,EUR,German Industrial Production (MoM)  (Aug),Medium
2025-10-08 09:15,EUR,German Buba Vice President Buch Speaks,Medium
2025-10-08 10:30,EUR,ECB's Elderson Speaks,Medium
2025-10-08 13:00,EUR,ECB Supervisory Board Member Tuominen Speaks,Medium
2025-10-08 13:30,USD,Fed Vice Chair for Supervision Barr Speaks,Medium
2025-10-08 14:30,USD,Cushing Crude Oil Inventories,Medium
2025-10-08 14:30,USD,Crude Oil Inventories,High
2025-10-08 15:00,GBP,BoE MPC Member Pill Speaks,Medium
2025-10-08 16:00,EUR,ECB President Lagarde Speaks,Medium
2025-10-08 17:00,USD,10-Year Note Auction,High
2025-10-08 18:00,USD,FOMC Meeting Minutes,High
2025-10-08 19:15,USD,FOMC Member Kashkari Speaks,Medium
2025-10-08 21:45,USD,Fed Vice Chair for Supervision Barr Speaks,Medium
2025-10-09 06:00,EUR,German Trade Balance  (Aug),Medium
2025-10-09 07:00,EUR,German Buba Balz Speaks,Medium
2025-10-09 08:30,GBP,BoE MPC Member Mann Speaks,Medium
2025-10-09 10:00,EUR,Eurogroup Meetings,Medium
2025-10-09 11:30,EUR,ECB Publishes Account of Monetary Policy Meeting,Medium
2025-10-09 12:00,CAD,BoC Senior Deputy Governor Rogers Speaks,Medium
2025-10-09 12:30,USD,Fed Chair Powell Speaks,High
2025-10-09 12:35,USD,FOMC Member Bowman Speaks,Medium
2025-10-09 15:00,EUR,ECB's Lane Speaks,Medium
2025-10-09 16:00,USD,WASDE Report,Medium
2025-10-09 16:45,USD,Fed Vice Chair for Supervision Barr Speaks,Medium
2025-10-09 17:00,USD,30-Year Bond Auction,High
2025-10-09 19:45,USD,FOMC Member Bowman Speaks,Medium
2025-10-09 20:30,USD,Fed's Balance Sheet,Medium
2025-10-09 21:30,NZD,Business NZ PMI  (Sep),Medium
2025-10-09 22:00,AUD,RBA Assist Gov Kent Speaks,Medium
2025-10-10 01:40,USD,FOMC Member Daly Speaks,Medium
2025-10-10 07:00,CHF,SECO Consumer Climate,Medium
2025-10-10 12:30,CAD,Unemployment Rate  (Sep),Medium
2025-10-10 12:30,CAD,Employment Change  (Sep),Medium
2025-10-10 14:00,USD,Michigan Consumer Sentiment  (Oct),Medium
2025-10-10 14:00,USD,Michigan Consumer Expectations  (Oct),Medium
2025-10-10 14:00,USD,Michigan 5-Year Inflation Expectations  (Oct),Medium
2025-10-10 14:00,USD,Michigan 1-Year Inflation Expectations  (Oct),Medium
